{
    "id": "feat_battle_hardened",
    "name": "Battle Hardened",
    "category": "general",
    "source": "homebrew",
    "prerequisites": {
        "requiredClassIds": [
            "class_fighter"
        ]
    },
    "grantedTraits": [
        "trait_feat_battle_hardened"
    ],
    "lore": {
        "shortDescription": "Your martial discipline grants you a +1 bonus to Armor Class."
    },
    "tags": [
        "armor_class"
    ]
}